{
    "name": "芝See菇Bi Family",
    "kind": "series",
    "enabled": true,
    "order": 1,
    "tile": "tile.webp",
    "disc": "disc.webp",
    "audio": {
        "host": "r2",
        "folder": "芝See菇Bi Family",
        "file": "{no2} - {arc} - 第{noZh}集[ - {title}].m4a"
    },
    "theme": {
        "bg": "#ffeb85",
        "surface": "#fff5c2",
        "track": "#f5d23c",
        "accent": "#f7901e",
        "onAccent": "#2b1a0c",
        "title": "#a84800",
        "accentText": "#a84800",
        "text": "#3b2412",
        "muted": "#7a5a20",
        "shadowDark": "#e6cc5c",
        "shadowLight": "#fff9dc",
        "scheme": "light",
        "statusBar": "#a84800",
        "headerRule": "radial-gradient(circle, #f7901e 1.5px, transparent 2px) 0 100% / 8px 4px repeat-x"
    },
    "arcs": [
        {
            "name": "三十六計",
            "addedAt": "2026-10-24",
            "episodes": [
                "瞞天過海 _ 隠形墨水筆",
                "無中生有 _ 你騙我騙你",
                "聲東擊西 _ 突擊檢查大作戰",
                "順手牽羊 _ 一代橋王苦榮",
                "反客為主 _ 臭爆插班生亞沙",
                "拋磚引玉 _ 看透一切的維園呀伯",
                "笑裡藏刀 _ 小學雞大報仇",
                "反間計 _ 手掌, 手背, 反轉再反轉都係肉",
                "樹上開花 _ IFC 鬥智大比拼",
                "以逸待勞 _ 智取亞生成績表",
                "假途伐虢 _ 英雄本色",
                "空城計 _ 晶晶和亞偉",
                "指桑罵槐 _ 談真誠 VS 講大話",
                "借屍還魂 _ 男女互氹大比賽",
                "假痴不癲 _ 他和她的秘密",
                "圍魏救趙 _ 感動浪漫的一天",
                "美人計 _ 小姐你係邊位？",
                "上屋抽梯 _ 消聲匿跡愛一天",
                "遠交近攻 _ 被煽動的賽果",
                "隔岸觀火 _ 當堂... 當堂咩嘢都變晒",
                "走為上計 _ 好憎講大話既自己",
                "李代桃僵 _ 義氣女兒小苦妹",
                "暗渡陳倉 _ 危險的冤枉路",
                "調虎離山 _ 亞沙握手成功, 苦榮命途難料",
                "趁火打劫 _ 生死未卜的苦榮",
                "混水摸魚 _ 潛入北京舞蹈學園",
                "釜底抽薪 _ 咩都冇晒既老千",
                "吊著條癮 _ 沙, 我愛你",
                "那年秋天 _ 林狗與當堂",
                "真相大白 _ 林狗的愛情故事",
                "團結力量 _ 對付老千大佬謝賢",
                "拋磚引玉 + 欲擒先縱 _ 拳賽大騙局",
                "打草驚蛇 _ 大老千, 落搭吧!",
                "苦肉計 _ 總動員, 努力做場好 Show!!",
                "連環計 _ 弱肉強食皇者無敵",
                "偷樑換柱 + 金蟬脫殼 + 擒賊擒王 _ 完美的結局"
            ]
        },
        {
            "name": "你生日所以我生日",
            "episodes": 3
        },
        {
            "name": "初戀嗱喳麵",
            "addedAt": "2026-10-25",
            "firstNo": 0,
            "episodes": 26,
            "titles": {
                "0": "前傳",
                "21": "後傳1",
                "22": "後傳2",
                "23": "後傳3",
                "24": "後傳4",
                "25": "後傳5"
            }
        },
        {
            "name": "大妒忌",
            "episodes": 3
        },
        {
            "name": "好朋友手牽手",
            "episodes": ["好傾朋友", "朋友不同", "朋友性別", "朋友第一"]
        },
        {
            "name": "小苦妹撲水",
            "episodes": 4
        },
        {
            "name": "我們都在會考中成長",
            "episodes": ["能源的故事", "舊底的故事"]
        },
        {
            "name": "游亁水",
            "episodes": 4
        },
        {
            "name": "苦榮去做GYM",
            "episodes": 4
        },
        {
            "name": "青春期",
            "episodes": 4
        },
        {
            "name": "青春期眞神奇",
            "episodes": ["男女先後", "多少問題", "時間長短"]
        },
        {
            "name": "Ｘ時mas時小提議",
            "episodes": ["不如休養下", "哥哥你洽我", "著襪索腳汗", "認認真真搵返個人"]
        }
    ]
}
